No,Data Type,Keywords,Best Chart Type,Secondary Options,When to Use,When NOT to Use,Data Volume Threshold,Color Guidance,Accessibility Grade,Accessibility Notes,A11y Fallback,Library Recommendation,Interactive Level
1,Trend Over Time,"trend, time-series, line, growth, timeline, progress",Line Chart,"Area Chart, Smooth Area","Data has a time axis; observe rise/fall trends over a continuous period","Fewer than 4 pts (use stat card); no time dimension exists","<1000 pts: SVG; >=1000 pts: Canvas","Primary: #0080FF",AA,"Differentiate by line style (solid/dashed)","Togglable data table","Chart.js, Recharts, ApexCharts",Hover + Zoom
2,Compare Categories,"compare, categories, bar, comparison, ranking",Bar Chart,"Column Chart, Grouped Bar","Comparing discrete categories by magnitude; ranking","Categories > 15 (use table); showing proportions (use waffle)","<20 categories: vertical; 20-50: horizontal","Distinct colors per bar",AAA,"Value labels on bars by default","Value labels always visible","Chart.js, Recharts, D3.js",Hover + Sort
3,Part-to-Whole,"part-to-whole, pie, donut, percentage, proportion, share",Pie Chart or Donut,"Stacked Bar, Waffle Chart","<=5 categories; one dominant segment; visual proportion focus","Categories > 5; precise values needed; accessibility-first","Max 6 slices","Contrast palette. Label with %",C,"Must provide stacked bar + table fallback","Percentage data table","Chart.js, Recharts, D3.js",Hover + Drill
4,Correlation,"correlation, scatter, relationship, pattern, cluster",Scatter Plot,"Heat Map, Matrix","Relationship between two variables; clusters or outliers","Variables are categorical; fewer than 20 points","<500 pts: SVG; 500-5000: Canvas","Gradient axis. Opacity: 0.6-0.8",B,"Combine color + shape distinction","Data table + shape markers","D3.js, Plotly, Recharts",Hover + Brush
5,Intensity,"heatmap, intensity, density, matrix, calendar",Heat Map,"Grid Heat Map","Intensity/density across a 2D grid; time patterns","Fewer than 20 cells; exact values needed","Up to 10,000 cells","Cool (blue) to Hot (red)","Numerical value on hover","Numeric legend must be included","D3.js, Plotly, ApexCharts",Hover + Zoom
